[
  {
    "institution_id": "TH-MHESI-CLINICTECH",
    "institution_name": "Technology Clinic Network (ClinicTech), MHESI",
    "mechanism_name": "Technology Clinic Network",
    "country": "TH",
    "jurisdiction": "Thailand",
    "institution_class": "I0",
    "phase_fit": ["P0", "P1", "P2", "P3", "P4"],
    "target_user": ["citizen", "community", "entrepreneur", "SME"],
    "citizen_accessibility": "A4",
    "eligibility": ["varies by clinic/node"],
    "entry_channel": ["https://clinictech.ops.go.th/online/cmo/site.asp"],
    "capability": ["consultation", "technology matching", "university knowledge transfer", "community support"],
    "service_type": ["advice", "expert matching", "technology transfer"],
    "geographic_coverage": "Thailand; distributed network",
    "price_or_cofunding": null,
    "turnaround_if_known": null,
    "application_window_if_any": null,
    "legal_authority_if_any": null,
    "accreditation_if_any": null,
    "evidence_of_activity": ["public national ClinicTech portal"],
    "source_url": "https://clinictech.ops.go.th/online/cmo/site.asp",
    "last_verified": "2026-09-11",
    "fallback_routes": ["nearby university academic service", "regional science park"],
    "notes": "Capability and availability vary by node; re-verify before routing."
  },
  {
    "institution_id": "TH-MHESI-RSP",
    "institution_name": "Regional Science Parks, MHESI",
    "mechanism_name": "Regional Science Park Network",
    "country": "TH",
    "jurisdiction": "Thailand",
    "institution_class": "I2",
    "phase_fit": ["P3", "P4", "P5", "P6", "P7", "P8", "P10"],
    "target_user": ["researcher", "entrepreneur", "SME", "industry", "community"],
    "citizen_accessibility": "A3",
    "eligibility": ["service/program dependent"],
    "entry_channel": ["https://rsp.mhesi.go.th/about/"],
    "capability": ["expert access", "laboratory", "prototype", "R&D collaboration", "incubation", "industry linkage"],
    "service_type": ["technical service", "research support", "incubation"],
    "geographic_coverage": "Thailand; regional network",
    "price_or_cofunding": null,
    "turnaround_if_known": null,
    "application_window_if_any": null,
    "legal_authority_if_any": null,
    "accreditation_if_any": null,
    "evidence_of_activity": ["MHESI regional science park network"],
    "source_url": "https://rsp.mhesi.go.th/about/",
    "last_verified": "2026-09-11",
    "fallback_routes": ["university academic service", "NSTDA", "TISTR"],
    "notes": "Local capabilities differ; route to the specific regional node."
  },
  {
    "institution_id": "TH-NSTDA-ITAP",
    "institution_name": "NSTDA",
    "mechanism_name": "Industrial Technology Assistance Program (ITAP)",
    "country": "TH",
    "jurisdiction": "Thailand",
    "institution_class": "I2",
    "phase_fit": ["P1", "P2", "P3", "P4", "P5"],
    "target_user": ["SME", "private enterprise"],
    "citizen_accessibility": "A2",
    "eligibility": ["SME/private-sector program criteria"],
    "entry_channel": ["https://itap.nstda.or.th/"],
    "capability": ["technical diagnosis", "expert matching", "technical project support"],
    "service_type": ["consultation", "expert matching", "technical assistance"],
    "geographic_coverage": "Thailand",
    "price_or_cofunding": "program-dependent co-funding/support",
    "turnaround_if_known": null,
    "application_window_if_any": null,
    "legal_authority_if_any": null,
    "accreditation_if_any": null,
    "evidence_of_activity": ["official ITAP service portal"],
    "source_url": "https://itap.nstda.or.th/",
    "last_verified": "2026-09-11",
    "fallback_routes": ["regional science park", "university", "TISTR"],
    "notes": "Best suited when the problem is already a legible SME technical problem."
  },
  {
    "institution_id": "TH-TISTR-SERVICES",
    "institution_name": "Thailand Institute of Scientific and Technological Research (TISTR)",
    "mechanism_name": "TISTR One-Stop / Technical Services",
    "country": "TH",
    "jurisdiction": "Thailand",
    "institution_class": "I2",
    "phase_fit": ["P3", "P4", "P5", "P6", "P10"],
    "target_user": ["citizen", "entrepreneur", "SME", "industry", "researcher"],
    "citizen_accessibility": "A3",
    "eligibility": ["service dependent"],
    "entry_channel": ["https://www.tistr.or.th/page_services.php", "https://tistrservices.tistr.or.th/"],
    "capability": ["analysis", "testing", "R&D", "consulting", "certification", "pilot production", "training"],
    "service_type": ["laboratory", "technical service", "consulting", "production service"],
    "geographic_coverage": "Thailand",
    "price_or_cofunding": "fee/service dependent",
    "turnaround_if_known": null,
    "application_window_if_any": null,
    "legal_authority_if_any": null,
    "accreditation_if_any": "service-specific",
    "evidence_of_activity": ["official TISTR services portal"],
    "source_url": "https://www.tistr.or.th/page_services.php",
    "last_verified": "2026-09-11",
    "fallback_routes": ["NSTDA", "university laboratory", "regional science park"],
    "notes": "Re-verify specific lab/service capability and accreditation."
  },
  {
    "institution_id": "TH-NIA-4G",
    "institution_name": "National Innovation Agency (NIA)",
    "mechanism_name": "4G: Groom, Grant, Growth, Global",
    "country": "TH",
    "jurisdiction": "Thailand",
    "institution_class": "I3",
    "phase_fit": ["P4", "P5", "P6", "P7", "P8", "P9", "P10", "P11"],
    "target_user": ["innovator", "startup", "innovation-driven enterprise"],
    "citizen_accessibility": "A2",
    "eligibility": ["program/call dependent"],
    "entry_channel": ["https://www.nia.or.th/4G-for-business-innovation"],
    "capability": ["innovation capability", "grant", "acceleration", "market", "investment", "global network"],
    "service_type": ["training", "funding", "acceleration", "market linkage"],
    "geographic_coverage": "Thailand and international program routes",
    "price_or_cofunding": "program dependent",
    "turnaround_if_known": null,
    "application_window_if_any": "call dependent",
    "legal_authority_if_any": null,
    "accreditation_if_any": null,
    "evidence_of_activity": ["official NIA 4G framework"],
    "source_url": "https://www.nia.or.th/4G-for-business-innovation",
    "last_verified": "2026-09-11",
    "fallback_routes": ["TED Fund", "science park", "depa", "PMUC"],
    "notes": "Not a default P0 citizen diagnosis desk; strongest once an innovation/venture need is legible."
  },
  {
    "institution_id": "TH-DIP-IPMART",
    "institution_name": "Department of Intellectual Property (DIP)",
    "mechanism_name": "IP Mart",
    "country": "TH",
    "jurisdiction": "Thailand",
    "institution_class": "I4",
    "phase_fit": ["P6", "P7"],
    "target_user": ["IP owner", "creator", "researcher", "business"],
    "citizen_accessibility": "A4",
    "eligibility": ["asset/listing/transaction conditions apply"],
    "entry_channel": ["https://ipmart.ipthailand.go.th/web-content/about-us"],
    "capability": ["IP listing", "buyer/seller matching", "business negotiation"],
    "service_type": ["marketplace", "matching"],
    "geographic_coverage": "Thailand",
    "price_or_cofunding": null,
    "turnaround_if_known": null,
    "application_window_if_any": null,
    "legal_authority_if_any": null,
    "accreditation_if_any": null,
    "evidence_of_activity": ["official IP Mart portal"],
    "source_url": "https://ipmart.ipthailand.go.th/web-content/about-us",
    "last_verified": "2026-09-11",
    "fallback_routes": ["university TTO", "direct industry matching"],
    "notes": "Matching channel, not commercialization vehicle; validate rights and transfer package first."
  },
  {
    "institution_id": "TH-TED-FUND",
    "institution_name": "Technology and Innovation-Based Enterprise Development Fund (TED Fund)",
    "mechanism_name": "IDEA / POC / TED Fellows",
    "country": "TH",
    "jurisdiction": "Thailand",
    "institution_class": "I3",
    "phase_fit": ["P4", "P5", "P7", "P8", "P9"],
    "target_user": ["youth entrepreneur", "startup", "innovator"],
    "citizen_accessibility": "A2",
    "eligibility": ["program-specific criteria"],
    "entry_channel": ["https://www.tedfund.mhesi.go.th/index.php/join-proj/ted-fund-youth-startup"],
    "capability": ["idea support", "proof of concept", "venture support", "market scaling"],
    "service_type": ["funding", "mentoring", "venture support"],
    "geographic_coverage": "Thailand",
    "price_or_cofunding": "program dependent",
    "turnaround_if_known": null,
    "application_window_if_any": "program/call dependent",
    "legal_authority_if_any": null,
    "accreditation_if_any": null,
    "evidence_of_activity": ["official TED Fund program portal"],
    "source_url": "https://www.tedfund.mhesi.go.th/index.php/join-proj/ted-fund-youth-startup",
    "last_verified": "2026-09-11",
    "fallback_routes": ["NIA", "science park", "university incubator"],
    "notes": "Eligibility-sensitive; verify current program rules before routing."
  },
  {
    "institution_id": "TH-DEPA",
    "institution_name": "Digital Economy Promotion Agency (depa)",
    "mechanism_name": "Digital funds / startup / transformation support",
    "country": "TH",
    "jurisdiction": "Thailand",
    "institution_class": "I3",
    "phase_fit": ["P3", "P4", "P5", "P7", "P8", "P9", "P10"],
    "target_user": ["digital startup", "enterprise", "community", "public sector"],
    "citizen_accessibility": "A2",
    "eligibility": ["program dependent"],
    "entry_channel": ["https://depa.or.th/th/funds", "https://www.depa.or.th/th/startup"],
    "capability": ["digital R&D", "startup support", "digital transformation", "market support"],
    "service_type": ["funding", "acceleration", "digital transformation"],
    "geographic_coverage": "Thailand",
    "price_or_cofunding": "program dependent",
    "turnaround_if_known": null,
    "application_window_if_any": "program dependent",